{
  "schema_version": "1.0",
  "annotation_batch_id": "dodf112-template-assisted-review",
  "created_at": "2026-08-18T00:00:00Z",
  "protocol": {
    "name": "dodf_human_annotation",
    "version": "1.0",
    "guide_uri": "repo:///docs/ANNOTATION_GUIDE_DODF.md"
  },
  "annotator": {
    "id": "reviewer-template",
    "kind": "human",
    "mode": "assisted_review"
  },
  "source": {
    "document_key": "dodf:2026-06-22:edicao-112:integra",
    "document_filename": "DODF 112 22-06-2026 INTEGRA.pdf",
    "document_sha256": "17389d23375c9b9b747c8a0f74305ce20ee4b52dbc20e23d92bef780ec4709fc",
    "page_count": 85,
    "baseline_commit": "e5d2f54352000e28c5b1a13a9085139ff35ed5af",
    "automatic_artifacts": [
      {
        "artifact_type": "structured_document",
        "uri": "repo:///data/structured/DODF%20112%2022-06-2026%20INTEGRA.structured.json",
        "sha256": "22a2da6eaff4cd8d8976ee0c43120fbebbb433fdd933b0ca0c5692f0f3e94719",
        "schema_version": "1.0"
      },
      {
        "artifact_type": "mentions",
        "uri": "repo:///data/extractions/DODF%20112%2022-06-2026%20INTEGRA.mentions.json",
        "sha256": "d2d154f1ebf7486f9b28d09cd76dc71a0e9c636129d0592a9af8261761e0176d",
        "schema_version": "1.0"
      }
    ]
  },
  "scope": {
    "pages": [1],
    "selection_method": "template_not_real_annotation",
    "pass_number": 1,
    "parent_batch_ids": []
  },
  "records": []
}
